{"schema_name":"subagent-task-envelope","schema_version":"2.0.0","kernel_version":"2.0.0","task_id":"11111111111111111111111111111111","logical_task_key":"source-acquisition-decision","role":"source_acquisition","authority_binding":{"kind":"kernel_run","run_id":"00000000000000000000000000000000","expected_coordination_revision":1,"target_checkpoint":"source_acquisition_decision_ready"},"prepared_at":"2026-07-15T01:02:03+08:00","task_root_path":"workflow/tasks/11111111111111111111111111111111","input_artifacts":[{"logical_id":"source_manifest","path":"source/manifest.json","generation":1,"sha256":"0000000000000000000000000000000000000000000000000000000000000000"}],"allowed_read_paths":["source/manifest.json","source/subtitles/subtitle.en.srt"],"protected_run_snapshot":[{"path":"workflow/run.json","sha256":"0000000000000000000000000000000000000000000000000000000000000000"}],"write_set":["workflow/source-acquisition-judgment-patch.json"],"required_outputs":[{"logical_id":"source_acquisition_decision","attempt_relative_path":"o/p.json","canonical_path":"workflow/source-acquisition-judgment-patch.json","schema_name":"source-acquisition-judgment-patch","expected_prior_generation":null,"expected_prior_sha256":null}],"generated_prompt":{"path":"workflow/tasks/11111111111111111111111111111111/prompt.md","sha256":"0000000000000000000000000000000000000000000000000000000000000000","role_template":{"identity":"source-acquisition","version":"1.0.0","path":"prompts/video-workflow/roles/source-acquisition.v1.md","sha256":"0000000000000000000000000000000000000000000000000000000000000000"},"platform_overlay":{"identity":"fixture","version":"1.0.0","path":"prompts/video-workflow/platforms/fixture.v1.md","sha256":"0000000000000000000000000000000000000000000000000000000000000000"}},"bounded_semantic_fields":["selected_subtitle_track","whisper_fallback.choice","whisper_fallback.rationale","known_gaps"],"resource_request":["codex_semantic"],"fairness_group_id":"00000000000000000000000000000000"}
